{
  "schema_version": "robot-contract-3.0",
  "robot_id": "deeprobotics_x30",
  "morphology": {
    "id": "quadruped_12dof",
    "legs": 4,
    "leg_pattern": [
      "hipx",
      "hipy",
      "knee"
    ],
    "leg_naming": "{LR}_{role}_joint",
    "leg_ids": [
      "FL",
      "FR",
      "HL",
      "HR"
    ],
    "actuated_via": "leg_pattern×legs"
  },
  "joints": {
    "actuated": [
      {
        "name": "FL_HipX_joint",
        "leg": "FL",
        "role": "hipx"
      },
      {
        "name": "FL_HipY_joint",
        "leg": "FL",
        "role": "hipy"
      },
      {
        "name": "FL_Knee_joint",
        "leg": "FL",
        "role": "knee"
      },
      {
        "name": "FR_HipX_joint",
        "leg": "FR",
        "role": "hipx"
      },
      {
        "name": "FR_HipY_joint",
        "leg": "FR",
        "role": "hipy"
      },
      {
        "name": "FR_Knee_joint",
        "leg": "FR",
        "role": "knee"
      },
      {
        "name": "HL_HipX_joint",
        "leg": "HL",
        "role": "hipx"
      },
      {
        "name": "HL_HipY_joint",
        "leg": "HL",
        "role": "hipy"
      },
      {
        "name": "HL_Knee_joint",
        "leg": "HL",
        "role": "knee"
      },
      {
        "name": "HR_HipX_joint",
        "leg": "HR",
        "role": "hipx"
      },
      {
        "name": "HR_HipY_joint",
        "leg": "HR",
        "role": "hipy"
      },
      {
        "name": "HR_Knee_joint",
        "leg": "HR",
        "role": "knee"
      }
    ],
    "default_pose": [
      0.0,
      -0.8,
      1.5,
      0.0,
      -0.8,
      1.5,
      0.0,
      -0.8,
      1.5,
      0.0,
      -0.8,
      1.5
    ]
  },
  "actuator_profile": {
    "by_role": {
      "hipx": {
        "stiffness": 120.0,
        "damping": 5.0,
        "effort": 84.0,
        "armature": 0.0,
        "mode": "position"
      },
      "hipy": {
        "stiffness": 120.0,
        "damping": 5.0,
        "effort": 84.0,
        "armature": 0.0,
        "mode": "position"
      },
      "knee": {
        "stiffness": 160.0,
        "damping": 8.0,
        "effort": 150.0,
        "armature": 0.0,
        "mode": "position"
      }
    }
  },
  "action": {
    "joint_order": [
      "FL_HipX_joint",
      "FL_HipY_joint",
      "FL_Knee_joint",
      "FR_HipX_joint",
      "FR_HipY_joint",
      "FR_Knee_joint",
      "HL_HipX_joint",
      "HL_HipY_joint",
      "HL_Knee_joint",
      "HR_HipX_joint",
      "HR_HipY_joint",
      "HR_Knee_joint"
    ],
    "action_scale": 0.25
  },
  "observation": {
    "components": [],
    "dimension": 45
  },
  "control": {
    "control_hz": 50,
    "physics_hz": 200,
    "decimation": 4
  },
  "contract_id": "deeprobotics_x30_v3",
  "family": "Deeprobotics X30",
  "size_class": "L",
  "locomotion_type": "P",
  "description": "Deeprobotics X30。大型四足（12-DoF：HipX/HipY/Knee ×4），模型为包内 MJCF（厂商 mjcf 资产，碰撞已 primitive 化），髋关节力矩限幅 84 N·m、膝关节 150 N·m，统一 mjlab 1.6 运行时。",
  "tags": [
    "quadruped",
    "mjcf",
    "imported",
    "package",
    "deeprobotics_x30"
  ],
  "source": "deep_robotics_model_import"
}
