{
  "schema_version": "robot-contract-3.0",
  "robot_id": "unitree_b2w",
  "morphology": {
    "id": "wheel_leg_16dof",
    "legs": 4,
    "leg_pattern": [
      "hip",
      "thigh",
      "calf",
      "wheel"
    ],
    "leg_naming": "{LR}_{role}_joint",
    "leg_ids": [
      "FR",
      "FL",
      "RR",
      "RL"
    ],
    "actuated_via": "leg_pattern×legs（含 wheel 角色）"
  },
  "joints": {
    "actuated": [
      {
        "name": "FR_hip_joint",
        "leg": "FR",
        "role": "hip"
      },
      {
        "name": "FR_thigh_joint",
        "leg": "FR",
        "role": "thigh"
      },
      {
        "name": "FR_calf_joint",
        "leg": "FR",
        "role": "calf"
      },
      {
        "name": "FL_hip_joint",
        "leg": "FL",
        "role": "hip"
      },
      {
        "name": "FL_thigh_joint",
        "leg": "FL",
        "role": "thigh"
      },
      {
        "name": "FL_calf_joint",
        "leg": "FL",
        "role": "calf"
      },
      {
        "name": "RR_hip_joint",
        "leg": "RR",
        "role": "hip"
      },
      {
        "name": "RR_thigh_joint",
        "leg": "RR",
        "role": "thigh"
      },
      {
        "name": "RR_calf_joint",
        "leg": "RR",
        "role": "calf"
      },
      {
        "name": "RL_hip_joint",
        "leg": "RL",
        "role": "hip"
      },
      {
        "name": "RL_thigh_joint",
        "leg": "RL",
        "role": "thigh"
      },
      {
        "name": "RL_calf_joint",
        "leg": "RL",
        "role": "calf"
      },
      {
        "name": "FR_wheel_joint",
        "leg": "FR",
        "role": "wheel"
      },
      {
        "name": "FL_wheel_joint",
        "leg": "FL",
        "role": "wheel"
      },
      {
        "name": "RR_wheel_joint",
        "leg": "RR",
        "role": "wheel"
      },
      {
        "name": "RL_wheel_joint",
        "leg": "RL",
        "role": "wheel"
      }
    ],
    "default_pose": [
      0.0,
      0.5,
      -1.5,
      0.0,
      0.5,
      -1.5,
      0.0,
      0.8,
      -1.5,
      0.0,
      0.8,
      -1.5,
      0.0,
      0.0,
      0.0,
      0.0
    ]
  },
  "actuator_profile": {
    "by_role": {
      "hip": {
        "stiffness": 160.0,
        "damping": 5.0,
        "effort": 200.0,
        "mode": "position"
      },
      "thigh": {
        "stiffness": 160.0,
        "damping": 5.0,
        "effort": 200.0,
        "mode": "position"
      },
      "calf": {
        "stiffness": 160.0,
        "damping": 5.0,
        "effort": 300.0,
        "mode": "position"
      },
      "wheel": {
        "stiffness": 0.0,
        "damping": 1.0,
        "effort": 20.0,
        "mode": "position"
      }
    }
  },
  "action": {
    "joint_order": [
      "FR_hip_joint",
      "FR_thigh_joint",
      "FR_calf_joint",
      "FL_hip_joint",
      "FL_thigh_joint",
      "FL_calf_joint",
      "RR_hip_joint",
      "RR_thigh_joint",
      "RR_calf_joint",
      "RL_hip_joint",
      "RL_thigh_joint",
      "RL_calf_joint",
      "FR_wheel_joint",
      "FL_wheel_joint",
      "RR_wheel_joint",
      "RL_wheel_joint"
    ],
    "action_scale": 0.125
  },
  "observation": {
    "components": [],
    "dimension": 45
  },
  "control": {
    "control_hz": 50,
    "physics_hz": 200,
    "decimation": 4
  },
  "contract_id": "unitree_b2w_v3",
  "family": "Unitree B2-W",
  "size_class": "L",
  "locomotion_type": "W",
  "description": "Unitree B2-W。模型为包内 MJCF（rl_sar_zoo 资产），统一 mjlab 1.6 运行时。",
  "tags": [
    "wheel_leg",
    "mjcf",
    "imported",
    "package",
    "unitree_b2w"
  ],
  "source": "rl_sar_zoo_import"
}
